{
  "verdict": "pass",
  "round_no": 1,
  "identity_hash": "sha256:1111111111111111111111111111111111111111111111111111111111111111",
  "projection_hash": "sha256:2222222222222222222222222222222222222222222222222222222222222222",
  "adapter_sha256": "sha256:3333333333333333333333333333333333333333333333333333333333333333",
  "issues": []
}
